"id","code","name"
l10n_pe_table_17_01,01,PLAN CONTABLE GENERAL EMPRESARIAL
l10n_pe_table_17_02,02,PLAN CONTABLE GENERAL REVISADO
l10n_pe_table_17_03,03,PLAN DE CUENTAS PARA EMPRESAS DEL SISTEMA FINANCIERO, SUPERVISADAS POR SBS
l10n_pe_table_17_04,04,PLAN DE CUENTAS PARA ENTIDADES PRESTADORAS DE SALUD, SUPERVISADAS POR SBS
l10n_pe_table_17_05,05,PLAN DE CUENTAS PARA EMPRESAS DEL SISTEMA ASEGURADOR, SUPERVISADAS POR SBS
l10n_pe_table_17_06,06,PLAN DE CUENTAS DE LAS ADMINISTRADORAS PRIVADAS DE FONDOS DE PENSIONES, SUPERVISADAS POR SBS
l10n_pe_table_17_07,07,PLAN CONTABLE GUBERNAMENTAL
l10n_pe_table_17_08,99,OTROS
